
###### SECTION: identity
MacBookPro14,1
Apple Inc.

###### SECTION: kernel
Linux nixos 7.1.3 #1-NixOS SMP PREEMPT_DYNAMIC Sat Jul  4 11:45:09 UTC 2026 x86_64 GNU/Linux
BOOT_IMAGE=/boot//nix/store/w11d7jgvwafbm5kys94db93n4afja8hs-linux-7.1.3/bzImage findiso= init=/nix/store/72zgqz60pzblincibdb2al47ab4kb9q3-nixos-system-nixos-26.05.5092.4382ed2b7a68/init elevator=noop root=fstab splash loglevel=4 lsm=landlock,yama,bpf

###### SECTION: audio-codec-CRITICAL
 0 [PCH            ]: HDA-Intel - HDA Intel PCH
                      HDA Intel PCH at 0x92820000 irq 63
--- /proc/asound/card0/codec#0
Codec: Cirrus Logic CS8409
Address: 0
AFG Function Id: 0x1 (unsol 1)
Vendor Id: 0x10138409
Subsystem Id: 0x106b3300
Revision Id: 0x100100
No Modem Function Group found
Default PCM:
    rates [0x17f]: 8000 11025 16000 22050 32000 44100 48000 96000
    bits [0x1a]: 16 24 32
    formats [0x1]: PCM
Default Amp-In caps: N/A
Default Amp-Out caps: N/A
State of AFG node 0x01:
  Power states:  D0 D3 D3cold S3D3cold CLKSTOP EPSS
  Power: setting=D0, actual=D0
GPIO: io=8, o=0, i=0, unsolicited=1, wake=1
  IO[0]: enable=0, dir=0, wake=0, sticky=0, data=0, unsol=0
  IO[1]: enable=0, dir=0, wake=0, sticky=0, data=0, unsol=0
  IO[2]: enable=0, dir=0, wake=0, sticky=0, data=0, unsol=0
  IO[3]: enable=0, dir=0, wake=0, sticky=0, data=0, unsol=0
  IO[4]: enable=0, dir=0, wake=0, sticky=0, data=0, unsol=0
  IO[5]: enable=0, dir=0, wake=0, sticky=0, data=0, unsol=0
  IO[6]: enable=0, dir=0, wake=0, sticky=0, data=0, unsol=0
  IO[7]: enable=0, dir=0, wake=0, sticky=0, data=0, unsol=0
Node 0x02 [Audio Output] wcaps 0x60001: Stereo
  Device: name="CS8409 Analog", type="Audio", device=0
  Converter: stream=0, channel=0
  Delay: 6 samples
Node 0x03 [Audio Output] wcaps 0x60001: Stereo
  Converter: stream=0, channel=0
  Delay: 6 samples
Node 0x04 [Audio Output] wcaps 0x60001: Stereo
  Converter: stream=0, channel=0
  Delay: 6 samples
Node 0x05 [Audio Output] wcaps 0x60001: Stereo
  Converter: stream=0, channel=0
  Delay: 6 samples
Node 0x06 [Audio Output] wcaps 0x60001: Stereo
  Converter: stream=0, channel=0
  Delay: 6 samples
Node 0x07 [Audio Output] wcaps 0x60001: Stereo
  Converter: stream=0, channel=0
  Delay: 6 samples
Node 0x08 [Audio Output] wcaps 0x60001: Stereo
  Converter: stream=0, channel=0
  Delay: 6 samples
Node 0x09 [Audio Output] wcaps 0x60001: Stereo
  Converter: stream=0, channel=0
  Delay: 6 samples
Node 0x0a [Audio Output] wcaps 0x60001: Stereo
  Converter: stream=0, channel=0
  Delay: 6 samples
Node 0x0b [Audio Output] wcaps 0x60001: Stereo
  Converter: stream=0, channel=0
  Delay: 6 samples
Node 0x0c [Audio Output] wcaps 0x60001: Stereo
  Converter: stream=0, channel=0
  Delay: 6 samples
Node 0x0d [Audio Output] wcaps 0x60001: Stereo
  Converter: stream=0, channel=0
  Delay: 6 samples
Node 0x0e [Audio Output] wcaps 0x60001: Stereo
  Converter: stream=0, channel=0
  Delay: 6 samples
Node 0x0f [Audio Output] wcaps 0x60001: Stereo
  Converter: stream=0, channel=0
  Delay: 6 samples
Node 0x10 [Audio Output] wcaps 0x60001: Stereo
  Converter: stream=0, channel=0
  Delay: 6 samples
Node 0x11 [Audio Output] wcaps 0x60001: Stereo
  Converter: stream=0, channel=0
  Delay: 6 samples
Node 0x12 [Audio Input] wcaps 0x160101: Stereo
  Device: name="CS8409 Analog", type="Audio", device=0
  Converter: stream=0, channel=0
  SDI-Select: 0
  Delay: 6 samples
  Connection: 1
     0x34
Node 0x13 [Audio Input] wcaps 0x160101: Stereo
  Converter: stream=0, channel=0
  SDI-Select: 0
  Delay: 6 samples
  Connection: 1
     0x35
Node 0x14 [Audio Input] wcaps 0x160101: Stereo
  Converter: stream=0, channel=0
  SDI-Select: 0
  Delay: 6 samples
  Connection: 1
     0x36
Node 0x15 [Audio Input] wcaps 0x160101: Stereo
  Converter: stream=0, channel=0
  SDI-Select: 0
  Delay: 6 samples
  Connection: 1
     0x37
Node 0x16 [Audio Input] wcaps 0x160101: Stereo
  Converter: stream=0, channel=0
  SDI-Select: 0
  Delay: 6 samples
  Connection: 1
     0x38
Node 0x17 [Audio Input] wcaps 0x160101: Stereo
  Converter: stream=0, channel=0
  SDI-Select: 0
  Delay: 6 samples
  Connection: 1
     0x39
Node 0x18 [Audio Input] wcaps 0x160101: Stereo
  Converter: stream=0, channel=0
  SDI-Select: 0
  Delay: 6 samples
  Connection: 1
     0x3a
Node 0x19 [Audio Input] wcaps 0x160101: Stereo
  Converter: stream=0, channel=0
  SDI-Select: 0
  Delay: 6 samples
  Connection: 1
     0x3b
Node 0x1a [Audio Input] wcaps 0x160101: Stereo
  Converter: stream=0, channel=0
  SDI-Select: 0
  Delay: 6 samples
  Connection: 1
     0x3c
Node 0x1b [Audio Input] wcaps 0x160101: Stereo
  Converter: stream=0, channel=0
  SDI-Select: 0
  Delay: 6 samples
  Connection: 1
     0x3d
Node 0x1c [Audio Input] wcaps 0x160101: Stereo
  Converter: stream=0, channel=0
  SDI-Select: 0
  Delay: 6 samples
  Connection: 1
     0x3e
Node 0x1d [Audio Input] wcaps 0x160101: Stereo
  Converter: stream=0, channel=0
  SDI-Select: 0
  Delay: 6 samples
  Connection: 1
     0x3f
Node 0x1e [Audio Input] wcaps 0x160101: Stereo
  Converter: stream=0, channel=0
  SDI-Select: 0
  Delay: 6 samples
  Connection: 1
     0x40
Node 0x1f [Audio Input] wcaps 0x160101: Stereo
  Converter: stream=0, channel=0
  SDI-Select: 0
  Delay: 6 samples
  Connection: 1
     0x41
Node 0x20 [Audio Input] wcaps 0x160101: Stereo
  Converter: stream=0, channel=0
  SDI-Select: 0
  Delay: 6 samples
  Connection: 1
     0x42
Node 0x21 [Audio Input] wcaps 0x160101: Stereo
  Converter: stream=0, channel=0
  SDI-Select: 0
  Delay: 6 samples
  Connection: 1
     0x43
Node 0x22 [Audio Input] wcaps 0x18051b: Stereo Amp-In
  Control: name="Internal Mic Capture Volume", index=0, device=0
    ControlAmp: chs=3, dir=In, idx=0, ofs=0
  Control: name="Internal Mic Capture Switch", index=0, device=0
    ControlAmp: chs=3, dir=In, idx=0, ofs=0
  Amp-In caps: ofs=0x33, nsteps=0x3f, stepsize=0x03, mute=1
  Amp-In vals:  [0x3f 0x3f]
  Converter: stream=0, channel=0
  SDI-Select: 0
  PCM:
    rates [0x1f5]: 8000 16000 32000 44100 48000 88200 96000
    bits [0x1e]: 16 20 24 32
    formats [0x1]: PCM
  Power states:  D0 D3 EPSS
  Power: setting=D3, actual=D3
  Delay: 8 samples
  Connection: 1
     0x44
Node 0x23 [Audio Input] wcaps 0x18051b: Stereo Amp-In
  Amp-In caps: ofs=0x33, nsteps=0x3f, stepsize=0x03, mute=1
  Amp-In vals:  [0xb3 0xb3]
  Converter: stream=0, channel=0
  SDI-Select: 0
  PCM:
    rates [0x1f5]: 8000 16000 32000 44100 48000 88200 96000
    bits [0x1e]: 16 20 24 32
    formats [0x1]: PCM
  Power states:  D0 D3 EPSS
  Power: setting=D3, actual=D3
  Delay: 8 samples
  Connection: 1
     0x45
Node 0x24 [Pin Complex] wcaps 0x400101: Stereo
  Pincap 0x00000010: OUT
  Pin Default 0x90100110: [Fixed] Speaker at Int N/A
    Conn = Unknown, Color = Unknown
    DefAssociation = 0x1, Sequence = 0x0
    Misc = NO_PRESENCE
  Pin-ctls: 0x40: OUT
  Connection: 1
     0x02
Node 0x25 [Pin Complex] wcaps 0x400101: Stereo
  Pincap 0x00000010: OUT
  Pin Default 0x90100111: [Fixed] Speaker at Int N/A
    Conn = Unknown, Color = Unknown
    DefAssociation = 0x1, Sequence = 0x1
    Misc = NO_PRESENCE
  Pin-ctls: 0x40: OUT
  Connection: 1
     0x03
Node 0x26 [Pin Complex] wcaps 0x400101: Stereo
  Pincap 0x00000010: OUT
  Pin Default 0x400000f0: [N/A] Line Out at Ext N/A
    Conn = Unknown, Color = Unknown
    DefAssociation = 0xf, Sequence = 0x0
  Pin-ctls: 0x00:
  Connection: 1
     0x04
Node 0x27 [Pin Complex] wcaps 0x400101: Stereo
  Pincap 0x00000010: OUT
  Pin Default 0x400000f0: [N/A] Line Out at Ext N/A
    Conn = Unknown, Color = Unknown
    DefAssociation = 0xf, Sequence = 0x0
  Pin-ctls: 0x00:
  Connection: 1
     0x05
Node 0x28 [Pin Complex] wcaps 0x400101: Stereo
  Pincap 0x00000010: OUT
  Pin Default 0x400000f0: [N/A] Line Out at Ext N/A
    Conn = Unknown, Color = Unknown
    DefAssociation = 0xf, Sequence = 0x0
  Pin-ctls: 0x00:
  Connection: 1
     0x06
Node 0x29 [Pin Complex] wcaps 0x400101: Stereo
  Pincap 0x00000010: OUT
  Pin Default 0x400000f0: [N/A] Line Out at Ext N/A
    Conn = Unknown, Color = Unknown
    DefAssociation = 0xf, Sequence = 0x0
  Pin-ctls: 0x00:
  Connection: 1
     0x07
Node 0x2a [Pin Complex] wcaps 0x400101: Stereo
  Pincap 0x00000010: OUT
  Pin Default 0x400000f0: [N/A] Line Out at Ext N/A
    Conn = Unknown, Color = Unknown
    DefAssociation = 0xf, Sequence = 0x0
  Pin-ctls: 0x00:
  Connection: 1
     0x08
Node 0x2b [Pin Complex] wcaps 0x400101: Stereo
  Pincap 0x00000010: OUT
  Pin Default 0x400000f0: [N/A] Line Out at Ext N/A
    Conn = Unknown, Color = Unknown
    DefAssociation = 0xf, Sequence = 0x0
  Pin-ctls: 0x00:
  Connection: 1
     0x09
Node 0x2c [Pin Complex] wcaps 0x400101: Stereo
  Pincap 0x00000010: OUT
  Pin Default 0x002b4020: [Jack] HP Out at Ext N/A
    Conn = Comb, Color = Green
    DefAssociation = 0x2, Sequence = 0x0
  Pin-ctls: 0x40: OUT
  Connection: 1
     0x0a
Node 0x2d [Pin Complex] wcaps 0x400101: Stereo
  Pincap 0x00000010: OUT
  Pin Default 0x400000f0: [N/A] Line Out at Ext N/A
    Conn = Unknown, Color = Unknown
    DefAssociation = 0xf, Sequence = 0x0
  Pin-ctls: 0x00:
  Connection: 1
     0x0b
Node 0x2e [Pin Complex] wcaps 0x400101: Stereo
  Pincap 0x00000010: OUT
  Pin Default 0x400000f0: [N/A] Line Out at Ext N/A
    Conn = Unknown, Color = Unknown
    DefAssociation = 0xf, Sequence = 0x0
  Pin-ctls: 0x00:
  Connection: 1
     0x0c
Node 0x2f [Pin Complex] wcaps 0x400101: Stereo
  Pincap 0x00000010: OUT
  Pin Default 0x400000f0: [N/A] Line Out at Ext N/A
    Conn = Unknown, Color = Unknown
    DefAssociation = 0xf, Sequence = 0x0
  Pin-ctls: 0x00:
  Connection: 1
     0x0d
Node 0x30 [Pin Complex] wcaps 0x400101: Stereo
  Pincap 0x00000010: OUT
  Pin Default 0x400000f0: [N/A] Line Out at Ext N/A
    Conn = Unknown, Color = Unknown
    DefAssociation = 0xf, Sequence = 0x0
  Pin-ctls: 0x00:
  Connection: 1
     0x0e
Node 0x31 [Pin Complex] wcaps 0x400101: Stereo
  Pincap 0x00000010: OUT
  Pin Default 0x400000f0: [N/A] Line Out at Ext N/A
    Conn = Unknown, Color = Unknown
    DefAssociation = 0xf, Sequence = 0x0
  Pin-ctls: 0x00:
  Connection: 1
     0x0f
Node 0x32 [Pin Complex] wcaps 0x400101: Stereo
  Pincap 0x00000010: OUT
  Pin Default 0x400000f0: [N/A] Line Out at Ext N/A
    Conn = Unknown, Color = Unknown
    DefAssociation = 0xf, Sequence = 0x0
  Pin-ctls: 0x00:
  Connection: 1
     0x10
Node 0x33 [Pin Complex] wcaps 0x400101: Stereo
  Pincap 0x00000010: OUT
  Pin Default 0x400000f0: [N/A] Line Out at Ext N/A
    Conn = Unknown, Color = Unknown
    DefAssociation = 0xf, Sequence = 0x0
  Pin-ctls: 0x00:
  Connection: 1
     0x11
Node 0x34 [Pin Complex] wcaps 0x400001: Stereo
  Pincap 0x00000020: IN
  Pin Default 0x400000f0: [N/A] Line Out at Ext N/A
    Conn = Unknown, Color = Unknown
    DefAssociation = 0xf, Sequence = 0x0
  Pin-ctls: 0x00:
Node 0x35 [Pin Complex] wcaps 0x400001: Stereo
  Pincap 0x00000020: IN
  Pin Default 0x400000f0: [N/A] Line Out at Ext N/A
    Conn = Unknown, Color = Unknown
    DefAssociation = 0xf, Sequence = 0x0
  Pin-ctls: 0x00:
Node 0x36 [Pin Complex] wcaps 0x400001: Stereo
  Pincap 0x00000020: IN
  Pin Default 0x400000f0: [N/A] Line Out at Ext N/A
    Conn = Unknown, Color = Unknown
    DefAssociation = 0xf, Sequence = 0x0
  Pin-ctls: 0x00:
Node 0x37 [Pin Complex] wcaps 0x400001: Stereo
  Pincap 0x00000020: IN
  Pin Default 0x400000f0: [N/A] Line Out at Ext N/A
    Conn = Unknown, Color = Unknown
    DefAssociation = 0xf, Sequence = 0x0
  Pin-ctls: 0x00:
Node 0x38 [Pin Complex] wcaps 0x400001: Stereo
  Pincap 0x00000020: IN
  Pin Default 0x400000f0: [N/A] Line Out at Ext N/A
    Conn = Unknown, Color = Unknown
    DefAssociation = 0xf, Sequence = 0x0
  Pin-ctls: 0x00:
Node 0x39 [Pin Complex] wcaps 0x400001: Stereo
  Pincap 0x00000020: IN
  Pin Default 0x400000f0: [N/A] Line Out at Ext N/A
    Conn = Unknown, Color = Unknown
    DefAssociation = 0xf, Sequence = 0x0
  Pin-ctls: 0x00:
Node 0x3a [Pin Complex] wcaps 0x400001: Stereo
  Pincap 0x00000020: IN
  Pin Default 0x400000f0: [N/A] Line Out at Ext N/A
    Conn = Unknown, Color = Unknown
    DefAssociation = 0xf, Sequence = 0x0
  Pin-ctls: 0x00:
Node 0x3b [Pin Complex] wcaps 0x400001: Stereo
  Pincap 0x00000020: IN
  Pin Default 0x400000f0: [N/A] Line Out at Ext N/A
    Conn = Unknown, Color = Unknown
    DefAssociation = 0xf, Sequence = 0x0
  Pin-ctls: 0x00:
Node 0x3c [Pin Complex] wcaps 0x400001: Stereo
  Pincap 0x00000020: IN
  Pin Default 0x00ab9030: [Jack] Mic at Ext N/A
    Conn = Comb, Color = Pink
    DefAssociation = 0x3, Sequence = 0x0
  Pin-ctls: 0x20: IN
Node 0x3d [Pin Complex] wcaps 0x400001: Stereo
  Pincap 0x00000020: IN
  Pin Default 0x400000f0: [N/A] Line Out at Ext N/A
    Conn = Unknown, Color = Unknown
    DefAssociation = 0xf, Sequence = 0x0
  Pin-ctls: 0x00:
Node 0x3e [Pin Complex] wcaps 0x400001: Stereo
  Pincap 0x00000020: IN
  Pin Default 0x400000f0: [N/A] Line Out at Ext N/A
    Conn = Unknown, Color = Unknown
    DefAssociation = 0xf, Sequence = 0x0
  Pin-ctls: 0x00:
Node 0x3f [Pin Complex] wcaps 0x400001: Stereo
  Pincap 0x00000020: IN
  Pin Default 0x400000f0: [N/A] Line Out at Ext N/A
    Conn = Unknown, Color = Unknown
    DefAssociation = 0xf, Sequence = 0x0
  Pin-ctls: 0x00:
Node 0x40 [Pin Complex] wcaps 0x400001: Stereo
  Pincap 0x00000020: IN
  Pin Default 0x400000f0: [N/A] Line Out at Ext N/A
    Conn = Unknown, Color = Unknown
    DefAssociation = 0xf, Sequence = 0x0
  Pin-ctls: 0x00:
Node 0x41 [Pin Complex] wcaps 0x400001: Stereo
  Pincap 0x00000020: IN
  Pin Default 0x400000f0: [N/A] Line Out at Ext N/A
    Conn = Unknown, Color = Unknown
    DefAssociation = 0xf, Sequence = 0x0
  Pin-ctls: 0x00:
Node 0x42 [Pin Complex] wcaps 0x400001: Stereo
  Pincap 0x00000020: IN
  Pin Default 0x400000f0: [N/A] Line Out at Ext N/A
    Conn = Unknown, Color = Unknown
    DefAssociation = 0xf, Sequence = 0x0
  Pin-ctls: 0x00:
Node 0x43 [Pin Complex] wcaps 0x400001: Stereo
  Pincap 0x00000020: IN
  Pin Default 0x400000f0: [N/A] Line Out at Ext N/A
    Conn = Unknown, Color = Unknown
    DefAssociation = 0xf, Sequence = 0x0
  Pin-ctls: 0x00:
Node 0x44 [Pin Complex] wcaps 0x40000b: Stereo Amp-In
  Control: name="Internal Mic Boost Volume", index=0, device=0
    ControlAmp: chs=3, dir=In, idx=0, ofs=0
  Amp-In caps: ofs=0x00, nsteps=0x02, stepsize=0x27, mute=0
  Amp-In vals:  [0x02 0x02]
  Pincap 0x00000020: IN
  Pin Default 0xa0a60100: [Fixed] Mic at Sep N/A
    Conn = Digital, Color = Unknown
    DefAssociation = 0x0, Sequence = 0x0
    Misc = NO_PRESENCE
  Pin-ctls: 0x20: IN
Node 0x45 [Pin Complex] wcaps 0x40000b: Stereo Amp-In
  Amp-In caps: ofs=0x00, nsteps=0x02, stepsize=0x27, mute=0
  Amp-In vals:  [0x00 0x00]
  Pincap 0x00000020: IN
  Pin Default 0x400000f0: [N/A] Line Out at Ext N/A
    Conn = Unknown, Color = Unknown
    DefAssociation = 0xf, Sequence = 0x0
  Pin-ctls: 0x00:
Node 0x46 [Beep Generator Widget] wcaps 0x700200: Mono Digital
Node 0x47 [Vendor Defined Widget] wcaps 0xf002c1: Stereo Digital
  Unsolicited: tag=00, enabled=0
  Processing caps: benign=0, ncoeff=255
--- /proc/asound/card0/codec#2
Codec: Intel Kabylake HDMI
Address: 2
AFG Function Id: 0x1 (unsol 0)
Vendor Id: 0x8086280b
Subsystem Id: 0x80860101
Revision Id: 0x100000
No Modem Function Group found
Default PCM:
    rates [0x0]:
    bits [0x0]:
    formats [0x0]:
Default Amp-In caps: N/A
Default Amp-Out caps: N/A
State of AFG node 0x01:
  Power states:  D0 D3 CLKSTOP EPSS
  Power: setting=D0, actual=D0, Clock-stop-OK
GPIO: io=0, o=0, i=0, unsolicited=0, wake=0
Node 0x02 [Audio Output] wcaps 0x6611: 8-Channels Digital
  Converter: stream=0, channel=0
  Digital: Enabled KAE
  Digital category: 0x0
  IEC Coding Type: 0x0
  PCM:
    rates [0x7f0]: 32000 44100 48000 88200 96000 176400 192000
    bits [0x1a]: 16 24 32
    formats [0x5]: PCM AC3
  Power states:  D0 D3 EPSS
  Power: setting=D0, actual=D0
Node 0x03 [Audio Output] wcaps 0x6611: 8-Channels Digital
  Converter: stream=0, channel=0
  Digital: Enabled KAE
  Digital category: 0x0
  IEC Coding Type: 0x0
  PCM:
    rates [0x7f0]: 32000 44100 48000 88200 96000 176400 192000
    bits [0x1a]: 16 24 32
    formats [0x5]: PCM AC3
  Power states:  D0 D3 EPSS
  Power: setting=D0, actual=D0
Node 0x04 [Audio Output] wcaps 0x6611: 8-Channels Digital
  Converter: stream=0, channel=0
  Digital: Enabled KAE
  Digital category: 0x0
  IEC Coding Type: 0x0
  PCM:
    rates [0x7f0]: 32000 44100 48000 88200 96000 176400 192000
    bits [0x1a]: 16 24 32
    formats [0x5]: PCM AC3
  Power states:  D0 D3 EPSS
  Power: setting=D0, actual=D0
Node 0x05 [Pin Complex] wcaps 0x40778d: 8-Channels Digital Amp-Out CP
  Amp-Out caps: ofs=0x00, nsteps=0x00, stepsize=0x00, mute=1
  Amp-Out vals:  [0x00 0x00]
  Pincap 0x0b000094: OUT Detect HBR HDMI DP
  Pin Default 0x18560010: [Jack] Digital Out at Int HDMI
    Conn = Digital, Color = Unknown
    DefAssociation = 0x1, Sequence = 0x0
  Pin-ctls: 0x00:
  Unsolicited: tag=00, enabled=0
  Power states:  D0 D3 EPSS
  Power: setting=D0, actual=D0
  Devices: 0
  Connection: 0
Node 0x06 [Pin Complex] wcaps 0x40778d: 8-Channels Digital Amp-Out CP
  Amp-Out caps: ofs=0x00, nsteps=0x00, stepsize=0x00, mute=1
  Amp-Out vals:  [0x00 0x00]
  Pincap 0x0b000094: OUT Detect HBR HDMI DP
  Pin Default 0x18560010: [Jack] Digital Out at Int HDMI
    Conn = Digital, Color = Unknown
    DefAssociation = 0x1, Sequence = 0x0
  Pin-ctls: 0x00:
  Unsolicited: tag=00, enabled=0
  Power states:  D0 D3 EPSS
  Power: setting=D0, actual=D0
  Devices: 0
  Connection: 0
Node 0x07 [Pin Complex] wcaps 0x40778d: 8-Channels Digital Amp-Out CP
  Amp-Out caps: ofs=0x00, nsteps=0x00, stepsize=0x00, mute=1
  Amp-Out vals:  [0x00 0x00]
  Pincap 0x0b000094: OUT Detect HBR HDMI DP
  Pin Default 0x18560010: [Jack] Digital Out at Int HDMI
    Conn = Digital, Color = Unknown
    DefAssociation = 0x1, Sequence = 0x0
  Pin-ctls: 0x00:
  Unsolicited: tag=00, enabled=0
  Power states:  D0 D3 EPSS
  Power: setting=D0, actual=D0
  Devices: 0
  Connection: 0
Node 0x08 [Vendor Defined Widget] wcaps 0xf00000: Mono
bash: line 11: aplay: command not found

###### SECTION: pci
00:00.0 Host bridge [0600]: Intel Corporation Xeon E3-1200 v6/7th Gen Core Processor Host Bridge/DRAM Registers [8086:5904] (rev 03)
00:02.0 VGA compatible controller [0300]: Intel Corporation Kaby Lake-U GT3 [Iris Plus Graphics 640] [8086:5926] (rev 06)
00:14.0 USB controller [0c03]: Intel Corporation Sunrise Point-LP USB 3.0 xHCI Controller [8086:9d2f] (rev 21)
00:15.0 Signal processing controller [1180]: Intel Corporation Sunrise Point-LP Serial IO I2C Controller #0 [8086:9d60] (rev 21)
00:15.2 Signal processing controller [1180]: Intel Corporation Sunrise Point-LP Serial IO I2C Controller #2 [8086:9d62] (rev 21)
00:16.0 Communication controller [0780]: Intel Corporation Sunrise Point-LP CSME HECI #1 [8086:9d3a] (rev 21)
00:1c.0 PCI bridge [0604]: Intel Corporation Sunrise Point-LP PCI Express Root Port #1 [8086:9d10] (rev f1)
00:1c.4 PCI bridge [0604]: Intel Corporation Sunrise Point-LP PCI Express Root Port #5 [8086:9d14] (rev f1)
00:1d.0 PCI bridge [0604]: Intel Corporation Sunrise Point-LP PCI Express Root Port #9 [8086:9d18] (rev f1)
00:1d.1 PCI bridge [0604]: Intel Corporation Sunrise Point-LP PCI Express Root Port #10 [8086:9d19] (rev f1)
00:1e.0 Signal processing controller [1180]: Intel Corporation Sunrise Point-LP Serial IO UART Controller #0 [8086:9d27] (rev 21)
00:1e.3 Signal processing controller [1180]: Intel Corporation Sunrise Point-LP Serial IO SPI Controller #1 [8086:9d2a] (rev 21)
00:1f.0 ISA bridge [0601]: Intel Corporation Sunrise Point LPC/eSPI Controller [8086:9d4e] (rev 21)
00:1f.2 Memory controller [0580]: Intel Corporation Sunrise Point-LP PMC [8086:9d21] (rev 21)
00:1f.3 Audio device [0403]: Intel Corporation Sunrise Point-LP HD Audio [8086:9d71] (rev 21)
00:1f.4 SMBus [0c05]: Intel Corporation Sunrise Point-LP SMBus [8086:9d23] (rev 21)
01:00.0 Mass storage controller [0180]: Apple Inc. S3X NVMe Controller [106b:2003] (rev 12)
02:00.0 Network controller [0280]: Broadcom Inc. and subsidiaries BCM4350 802.11ac Wireless Network Adapter [14e4:43a3] (rev 05)
03:00.0 Multimedia controller [0480]: Broadcom Inc. and subsidiaries 720p FaceTime HD Camera [14e4:1570]
04:00.0 PCI bridge [0604]: Intel Corporation DSL6540 Thunderbolt 3 Bridge [Alpine Ridge 4C 2015] [8086:1578] (rev 02)
05:00.0 PCI bridge [0604]: Intel Corporation JHL6540 Thunderbolt 3 Bridge (C step) [Alpine Ridge 4C 2016] [8086:15d3] (rev 02)
05:01.0 PCI bridge [0604]: Intel Corporation JHL6540 Thunderbolt 3 Bridge (C step) [Alpine Ridge 4C 2016] [8086:15d3] (rev 02)
05:02.0 PCI bridge [0604]: Intel Corporation JHL6540 Thunderbolt 3 Bridge (C step) [Alpine Ridge 4C 2016] [8086:15d3] (rev 02)
05:04.0 PCI bridge [0604]: Intel Corporation JHL6540 Thunderbolt 3 Bridge (C step) [Alpine Ridge 4C 2016] [8086:15d3] (rev 02)
06:00.0 System peripheral [0880]: Intel Corporation JHL6540 Thunderbolt 3 NHI (C step) [Alpine Ridge 4C 2016] [8086:15d2] (rev 02)
07:00.0 USB controller [0c03]: Intel Corporation JHL6540 Thunderbolt 3 USB Controller (C step) [Alpine Ridge 4C 2016] [8086:15d4] (rev 02)

###### SECTION: pci-verbose
00:1f.3 Audio device [0403]: Intel Corporation Sunrise Point-LP HD Audio [8086:9d71] (rev 21) (prog-if 00 [HDA compatible])
	Subsystem: Intel Corporation Device [8086:7270]
	Control: I/O- Mem+ BusMaster+ SpecCycle- MemWINV- VGASnoop- ParErr- Stepping- SERR- FastB2B- DisINTx+
	Status: Cap+ 66MHz- UDF- FastB2B- ParErr- DEVSEL=fast >TAbort- <TAbort- <MAbort- >SERR- <PERR- INTx-
	Latency: 64, Cache Line Size: 256 bytes
	Interrupts: pin B disabled, MSI(X) routed to IRQ 63
	Region 0: Memory at 92820000 (64-bit, non-prefetchable) [size=16K]
	Region 4: Memory at 4000000000 (64-bit, non-prefetchable) [size=64K]
	Capabilities: <access denied>
	Kernel driver in use: snd_hda_intel
	Kernel modules: snd_soc_avs, snd_sof_pci_intel_skl, snd_hda_intel

02:00.0 Network controller [0280]: Broadcom Inc. and subsidiaries BCM4350 802.11ac Wireless Network Adapter [14e4:43a3] (rev 05)
	Subsystem: Apple Inc. Device [106b:0170]
	Control: I/O- Mem+ BusMaster+ SpecCycle- MemWINV- VGASnoop- ParErr- Stepping- SERR- FastB2B- DisINTx+
	Status: Cap+ 66MHz- UDF- FastB2B- ParErr- DEVSEL=fast >TAbort- <TAbort- <MAbort- >SERR- <PERR- INTx-
	Latency: 0, Cache Line Size: 256 bytes
	Interrupts: pin B disabled, MSI(X) routed to IRQ 62
	Region 0: Memory at 92400000 (64-bit, non-prefetchable) [size=32K]
	Region 2: Memory at 92000000 (64-bit, non-prefetchable) [size=4M]
	Capabilities: <access denied>
	Kernel driver in use: brcmfmac
	Kernel modules: brcmfmac

01:00.0 Mass storage controller [0180]: Apple Inc. S3X NVMe Controller [106b:2003] (rev 12) (prog-if 02)
	Subsystem: Apple Inc. S3X NVMe Controller [106b:2003]
	Control: I/O- Mem+ BusMaster+ SpecCycle- MemWINV- VGASnoop- ParErr- Stepping- SERR- FastB2B- DisINTx+
	Status: Cap+ 66MHz- UDF- FastB2B- ParErr- DEVSEL=fast >TAbort- <TAbort- <MAbort- >SERR- <PERR- INTx-
	Latency: 0, Cache Line Size: 256 bytes
	Interrupts: pin B disabled, MSI(X) routed to IRQ 35-36
	Region 0: Memory at 92700000 (64-bit, non-prefetchable) [size=16K]
	Capabilities: <access denied>
	Kernel driver in use: nvme
	Kernel modules: nvme


###### SECTION: network
lo               UNKNOWN        127.0.0.1/8 ::1/128 
wlp2s0           UP             192.168.50.122/24 fe80::7467:ddb2:fe4e:8398/64 
lo               UNKNOWN        00:00:00:00:00:00 <LOOPBACK,UP,LOWER_UP> 
wlp2s0           UP             38:f9:d3:4d:94:10 <BROADCAST,MULTICAST,UP,LOWER_UP> 
bash: line 17: iw: command not found
0: hci0: Bluetooth
	Soft blocked: no
	Hard blocked: no
1: phy0: Wireless LAN
	Soft blocked: no
	Hard blocked: no
DEVICE          TYPE      STATE                   CONNECTION   
wlp2s0          wifi      connected               furtadosmith 
lo              loopback  connected (externally)  lo           
p2p-dev-wlp2s0  wifi-p2p  disconnected            --           
IN-USE  SSID                           SIGNAL  CHAN 
        --                             100     9    
        furtadosmith                   92      9    
*       furtadosmith                   82      161  
        AC_PY                          75      1    
        --                             75      1    
        --                             72      1    
        cameron                        55      3    
        --                             52      44   
        AC_PY                          52      44   
        xfinitywifi                    50      44   
        cameron5g                      47      153  

###### SECTION: firmware
filename:       /run/booted-system/kernel-modules/lib/modules/7.1.3/kernel/drivers/net/wireless/broadcom/brcm80211/brcmfmac/brcmfmac.ko.xz
license:        Dual BSD/GPL
description:    Broadcom 802.11 wireless LAN fullmac driver.
author:         Broadcom Corporation
firmware:       brcm/brcmfmac*-sdio.*.bin
firmware:       brcm/brcmfmac*-sdio.*.txt
firmware:       brcm/brcmfmac43752-sdio.clm_blob
firmware:       brcm/brcmfmac43752-sdio.bin
firmware:       brcm/brcmfmac43012-sdio.clm_blob
firmware:       brcm/brcmfmac43012-sdio.bin
firmware:       brcm/brcmfmac4373-sdio.clm_blob
firmware:       brcm/brcmfmac4373-sdio.bin

###### SECTION: input-applespi-CRITICAL
I: Bus=0019 Vendor=0000 Product=0005 Version=0000
N: Name="Lid Switch"
P: Phys=PNP0C0D/button/input0
S: Sysfs=/devices/platform/PNP0C0D:00/input/input0
U: Uniq=
H: Handlers=event0 
B: PROP=0
B: EV=21
B: SW=1

I: Bus=0019 Vendor=0000 Product=0001 Version=0000
N: Name="Power Button"
P: Phys=PNP0C0C/button/input0
S: Sysfs=/devices/platform/PNP0C0C:00/input/input1
U: Uniq=
H: Handlers=kbd event1 
B: PROP=0
B: EV=3
B: KEY=8000 10000000000000 0

I: Bus=0019 Vendor=0000 Product=0003 Version=0000
N: Name="Sleep Button"
P: Phys=PNP0C0E/button/input0
S: Sysfs=/devices/platform/PNP0C0E:00/input/input2
U: Uniq=
H: Handlers=kbd event2 
B: PROP=0
B: EV=3
B: KEY=4000 0 0

I: Bus=0019 Vendor=0000 Product=0001 Version=0000
N: Name="Power Button"
P: Phys=LNXPWRBN/button/input0
S: Sysfs=/devices/platform/LNXPWRBN:00/input/input3
U: Uniq=
H: Handlers=kbd event3 
B: PROP=0
B: EV=3
B: KEY=8000 10000000000000 0

I: Bus=001c Vendor=0000 Product=0000 Version=0000
N: Name="Apple SPI Keyboard"
P: Phys=applespi/input0
S: Sysfs=/devices/pci0000:00/0000:00:1e.3/pxa2xx-spi.3/spi_master/spi2/spi-APP000D:00/input/input4
U: Uniq=
H: Handlers=sysrq kbd event4 leds 
B: PROP=0
B: EV=120003
B: KEY=10000 0 0 0 6300001000 3800000000 710effd063c0001f ff7ffffffffffffe
B: LED=2

I: Bus=001c Vendor=06cb Product=0557 Version=0000
N: Name="Apple SPI Touchpad"
P: Phys=applespi/input1
S: Sysfs=/devices/pci0000:00/0000:00:1e.3/pxa2xx-spi.3/spi_master/spi2/spi-APP000D:00/input/input5
U: Uniq=
H: Handlers=event5 mouse0 
B: PROP=5
B: EV=f
B: KEY=e520 10000 0 0 0 0
B: REL=3
B: ABS=27f800000000003

I: Bus=0019 Vendor=0000 Product=0006 Version=0000
N: Name="Video Bus"
P: Phys=LNXVIDEO/video/input0
S: Sysfs=/devices/pci0000:00/acpi.video_bus.0/input/input6
U: Uniq=
H: Handlers=kbd event6 
B: PROP=0
B: EV=3
B: KEY=3e000b00000000 0 0 0

I: Bus=0000 Vendor=0000 Product=0000 Version=0000
N: Name="HDA Intel PCH HDMI/DP,pcm=3"
P: Phys=ALSA
S: Sysfs=/devices/pci0000:00/0000:00:1f.3/sound/card0/input7
U: Uniq=
H: Handlers=event7 
B: PROP=0
B: EV=21
B: SW=140

I: Bus=0000 Vendor=0000 Product=0000 Version=0000
N: Name="HDA Intel PCH HDMI/DP,pcm=7"
P: Phys=ALSA
S: Sysfs=/devices/pci0000:00/0000:00:1f.3/sound/card0/input8
U: Uniq=
H: Handlers=event8 
B: PROP=0
B: EV=21
B: SW=140

I: Bus=0000 Vendor=0000 Product=0000 Version=0000
N: Name="HDA Intel PCH HDMI/DP,pcm=8"
P: Phys=ALSA
S: Sysfs=/devices/pci0000:00/0000:00:1f.3/sound/card0/input9
U: Uniq=
H: Handlers=event9 
B: PROP=0
B: EV=21
B: SW=140

hid                   294912  1 snd_soc_sdca
spi_pxa2xx_platform    12288  0
spi_pxa2xx_core        36864  1 spi_pxa2xx_platform
mac_hid                16384  0
applesmc               36864  0
applespi               61440  0
led_class              28672  4 snd_hda_codec_generic,input_leds,applesmc,applespi
crc16                  12288  3 bluetooth,ext4,applespi
intel_lpss_pci         28672  4
intel_lpss             12288  1 intel_lpss_pci

###### SECTION: disks-CRITICAL
NAME          SIZE TYPE FSTYPE   MODEL             SERIAL
loop0         3.5G loop squashfs                   
sda         931.5G disk iso9660  Mobile SSD        00000000NAD24ZVV
├─sda1        3.6G part iso9660                    
└─sda2          3M part vfat                       
nvme0n1     465.9G disk          APPLE SSD AP0512J C08843605KKHV4MAK
├─nvme0n1p1   300M part vfat                       
└─nvme0n1p2 465.6G part apfs                       
nvme0n2         8K disk          APPLE SSD AP0512J C08843605KKHV4MAK
total 0
lrwxrwxrwx 1 root root 13 Mar 17 19:55 nvme-APPLE_SSD_AP0512J_C08843605KKHV4MAK -> ../../nvme0n1
lrwxrwxrwx 1 root root 13 Mar 17 19:55 nvme-APPLE_SSD_AP0512J_C08843605KKHV4MAK_1 -> ../../nvme0n1
lrwxrwxrwx 1 root root 15 Mar 17 19:55 nvme-APPLE_SSD_AP0512J_C08843605KKHV4MAK_1-part1 -> ../../nvme0n1p1
lrwxrwxrwx 1 root root 15 Mar 17 19:55 nvme-APPLE_SSD_AP0512J_C08843605KKHV4MAK_1-part2 -> ../../nvme0n1p2
lrwxrwxrwx 1 root root 13 Mar 17 19:55 nvme-APPLE_SSD_AP0512J_C08843605KKHV4MAK_2 -> ../../nvme0n2
lrwxrwxrwx 1 root root 15 Mar 17 19:55 nvme-APPLE_SSD_AP0512J_C08843605KKHV4MAK-part1 -> ../../nvme0n1p1
lrwxrwxrwx 1 root root 15 Mar 17 19:55 nvme-APPLE_SSD_AP0512J_C08843605KKHV4MAK-part2 -> ../../nvme0n1p2
lrwxrwxrwx 1 root root 13 Mar 17 19:55 nvme-nvme.106b-4330383834333630354b4b4856344d414b-4150504c4520535344204150303531324a-00000001 -> ../../nvme0n1
lrwxrwxrwx 1 root root 15 Mar 17 19:55 nvme-nvme.106b-4330383834333630354b4b4856344d414b-4150504c4520535344204150303531324a-00000001-part1 -> ../../nvme0n1p1
lrwxrwxrwx 1 root root 15 Mar 17 19:55 nvme-nvme.106b-4330383834333630354b4b4856344d414b-4150504c4520535344204150303531324a-00000001-part2 -> ../../nvme0n1p2
lrwxrwxrwx 1 root root 13 Mar 17 19:55 nvme-nvme.106b-4330383834333630354b4b4856344d414b-4150504c4520535344204150303531324a-00000002 -> ../../nvme0n2
lrwxrwxrwx 1 root root  9 Jan  1  2024 usb-LaCie_Mobile_SSD_00000000NAD24ZVV-0:0 -> ../../sda
lrwxrwxrwx 1 root root 10 Jan  1  2024 usb-LaCie_Mobile_SSD_00000000NAD24ZVV-0:0-part1 -> ../../sda1
lrwxrwxrwx 1 root root 10 Jan  1  2024 usb-LaCie_Mobile_SSD_00000000NAD24ZVV-0:0-part2 -> ../../sda2
Node                  Generic               SN                   Model                                    Namespace  Usage                      Format           FW Rev  
--------------------- --------------------- -------------------- ---------------------------------------- ---------- -------------------------- ---------------- --------
/dev/nvme0n1          /dev/ng0n1            C08843605KKHV4MAK    APPLE SSD AP0512J                        0x1        500.28  GB / 500.28  GB      4 KiB +  0 B   16.14.01
/dev/nvme0n2          /dev/ng0n2            C08843605KKHV4MAK    APPLE SSD AP0512J                        0x2          8.19  kB /   8.19  kB      4 KiB +  0 B   16.14.01
Disk /dev/loop0: 3.45 GiB, 3708211200 bytes, 7242600 sectors
Units: sectors of 1 * 512 = 512 bytes
Sector size (logical/physical): 512 bytes / 512 bytes
I/O size (minimum/optimal): 512 bytes / 512 bytes


Disk /dev/nvme0n1: 465.92 GiB, 500277792768 bytes, 122138133 sectors
Disk model: APPLE SSD AP0512J                       
Units: sectors of 1 * 4096 = 4096 bytes
Sector size (logical/physical): 4096 bytes / 4096 bytes
I/O size (minimum/optimal): 4096 bytes / 4096 bytes
Disklabel type: gpt
Disk identifier: 686026C0-CE16-4503-909F-022B21648D8D

Device         Start       End   Sectors   Size Type
/dev/nvme0n1p1     6     76805     76800   300M EFI System
/dev/nvme0n1p2 76806 122138127 122061322 465.6G Apple APFS


Disk /dev/nvme0n2: 8 KiB, 8192 bytes, 2 sectors
Disk model: APPLE SSD AP0512J                       
Units: sectors of 1 * 4096 = 4096 bytes
Sector size (logical/physical): 4096 bytes / 4096 bytes
I/O size (minimum/optimal): 4096 bytes / 4096 bytes


Disk /dev/sda: 931.51 GiB, 1000204886016 bytes, 1953525168 sectors
Disk model: Mobile SSD      
Units: sectors of 1 * 512 = 512 bytes
Sector size (logical/physical): 512 bytes / 512 bytes
I/O size (minimum/optimal): 4096 bytes / 4096 bytes
Disklabel type: dos
Disk identifier: 0x9fb6382f

Device     Boot Start     End Sectors Size Id Type
/dev/sda1  *        0 7471103 7471104 3.6G  0 Empty
/dev/sda2         284    6427    6144   3M ef EFI (FAT-12/16/32)

Partition 2 does not start on physical sector boundary.

###### SECTION: power-thermal
applesmc               36864  0
led_class              28672  4 snd_hda_codec_generic,input_leds,applesmc,applespi
ADP1
BAT0
79
Charging
bash: line 37: sensors: command not found

###### SECTION: graphics
00:02.0 VGA compatible controller [0300]: Intel Corporation Kaby Lake-U GT3 [Iris Plus Graphics 640] [8086:5926] (rev 06)

###### SECTION: bluetooth
Bus 001 Device 001: ID 1d6b:0002 Linux Foundation 2.0 root hub
Bus 002 Device 001: ID 1d6b:0003 Linux Foundation 3.0 root hub
Bus 003 Device 001: ID 1d6b:0002 Linux Foundation 2.0 root hub
Bus 004 Device 001: ID 1d6b:0003 Linux Foundation 3.0 root hub
Bus 004 Device 002: ID 059f:10ef LaCie, Ltd Mobile SSD

###### SECTION: efi
BootCurrent: 0000
BootOrder: 0080
Boot0080* Mac OS X	PciRoot(0x0)/Pci(0x1c,0x0)/Pci(0x0,0x0)//HD(2,GPT,40a503a3-c853-4ab9-af7e-fe2551132eab,0x12c06,0x746820a)/VenMedia(be74fcf7-0b7c-49f3-9147-01f4042e6842,11164878443b5248892343bc85791326)/\3E14C418-0BA2-4B54-BD72-EE8E2BD07747\System\Library\CoreServices\boot.efi
      dp: 02 01 0c 00 d0 41 03 0a 00 00 00 00 / 01 01 06 00 00 1c / 01 01 06 00 00 00 / 03 16 10 00 01 00 00 00 cc 03 00 08 a9 02 05 00 / 04 01 2a 00 02 00 00 00 06 2c 01 00 00 00 00 00 0a 82 46 07 00 00 00 00 a3 03 a5 40 53 c8 b9 4a af 7e fe 25 51 13 2e ab 02 02 / 04 03 24 00 f7 fc 74 be 7c 0b f3 49 91 47 01 f4 04 2e 68 42 11 16 48 78 44 3b 52 48 89 23 43 bc 85 79 13 26 / 04 04 9a 00 5c 00 33 00 45 00 31 00 34 00 43 00 34 00 31 00 38 00 2d 00 30 00 42 00 41 00 32 00 2d 00 34 00 42 00 35 00 34 00 2d 00 42 00 44 00 37 00 32 00 2d 00 45 00 45 00 38 00 45 00 32 00 42 00 44 00 30 00 37 00 37 00 34 00 37 00 5c 00 53 00 79 00 73 00 74 00 65 00 6d 00 5c 00 4c 00 69 00 62 00 72 00 61 00 72 00 79 00 5c 00 43 00 6f 00 72 00 65 00 53 00 65 00 72 00 76 00 69 00 63 00 65 00 73 00 5c 00 62 00 6f 00 6f 00 74 00 2e 00 65 00 66 00 69 00 00 00 / 7f ff 04 00
Boot0081* Mac OS X	PciRoot(0x0)/Pci(0x1c,0x0)/Pci(0x0,0x0)//HD(1,GPT,46e4626d-2600-4c68-a21a-20a29ba72844,0x6,0x12c00)/\EFI\APPLE\UPDATERS\MULTIUPDATER\MultiUpdater.efi540068006f0072005500740069006c002e00650066006900200028002d00670020002d006f0020002d0073007200200030002000300020002d006600730020006500660069002d006100700070006c0065002d007000610079006c006f006100640031002d00640061007400610020002d006e006f00720065007300650074002000290020000000
      dp: 02 01 0c 00 d0 41 03 0a 00 00 00 00 / 01 01 06 00 00 1c / 01 01 06 00 00 00 / 03 16 10 00 01 00 00 00 cc 03 00 08 a9 02 05 00 / 04 01 2a 00 01 00 00 00 06 00 00 00 00 00 00 00 00 2c 01 00 00 00 00 00 6d 62 e4 46 00 26 68 4c a2 1a 20 a2 9b a7 28 44 02 02 / 04 04 68 00 5c 00 45 00 46 00 49 00 5c 00 41 00 50 00 50 00 4c 00 45 00 5c 00 55 00 50 00 44 00 41 00 54 00 45 00 52 00 53 00 5c 00 4d 00 55 00 4c 00 54 00 49 00 55 00 50 00 44 00 41 00 54 00 45 00 52 00 5c 00 4d 00 75 00 6c 00 74 00 69 00 55 00 70 00 64 00 61 00 74 00 65 00 72 00 2e 00 65 00 66 00 69 00 00 00 / 7f ff 04 00
    data: 54 00 68 00 6f 00 72 00 55 00 74 00 69 00 6c 00 2e 00 65 00 66 00 69 00 20 00 28 00 2d 00 67 00 20 00 2d 00 6f 00 20 00 2d 00 73 00 72 00 20 00 30 00 20 00 30 00 20 00 2d 00 66 00 73 00 20 00 65 00 66 00 69 00 2d 00 61 00 70 00 70 00 6c 00 65 00 2d 00 70 00 61 00 79 00 6c 00 6f 00 61 00 64 00 31 00 2d 00 64 00 61 00 74 00 61 00 20 00 2d 00 6e 00 6f 00 72 00 65 00 73 00 65 00 74 00 20 00 29 00 20 00 00 00
Boot0082* 	PciRoot(0x0)/Pci(0x1c,0x0)/Pci(0x0,0x0)//HD(2,GPT,40a503a3-c853-4ab9-af7e-fe2551132eab,0x12c06,0x746820a)/VenMedia(be74fcf7-0b7c-49f3-9147-01f4042e6842,11164878443b5248892343bc85791326)/\3E14C418-0BA2-4B54-BD72-EE8E2BD07747\System\Library\CoreServices\boot.efi
      dp: 02 01 0c 00 d0 41 03 0a 00 00 00 00 / 01 01 06 00 00 1c / 01 01 06 00 00 00 / 03 16 10 00 01 00 00 00 cc 03 00 08 a9 02 05 00 / 04 01 2a 00 02 00 00 00 06 2c 01 00 00 00 00 00 0a 82 46 07 00 00 00 00 a3 03 a5 40 53 c8 b9 4a af 7e fe 25 51 13 2e ab 02 02 / 04 03 24 00 f7 fc 74 be 7c 0b f3 49 91 47 01 f4 04 2e 68 42 11 16 48 78 44 3b 52 48 89 23 43 bc 85 79 13 26 / 04 04 9a 00 5c 00 33 00 45 00 31 00 34 00 43 00 34 00 31 00 38 00 2d 00 30 00 42 00 41 00 32 00 2d 00 34 00 42 00 35 00 34 00 2d 00 42 00 44 00 37 00 32 00 2d 00 45 00 45 00 38 00 45 00 32 00 42 00 44 00 30 00 37 00 37 00 34 00 37 00 5c 00 53 00 79 00 73 00 74 00 65 00 6d 00 5c 00 4c 00 69 00 62 00 72 00 61 00 72 00 79 00 5c 00 43 00 6f 00 72 00 65 00 53 00 65 00 72 00 76 00 69 00 63 00 65 00 73 00 5c 00 62 00 6f 00 6f 00 74 00 2e 00 65 00 66 00 69 00 00 00 / 7f ff 04 00
BootFFFF* 	PciRoot(0x0)/Pci(0x1c,0x0)/Pci(0x0,0x0)//HD(2,GPT,40a503a3-c853-4ab9-af7e-fe2551132eab,0x12c06,0x746820a)/VenMedia(be74fcf7-0b7c-49f3-9147-01f4042e6842,11164878443b5248892343bc85791326)/\3E14C418-0BA2-4B54-BD72-EE8E2BD07747\System\Library\CoreServices\boot.efi
      dp: 02 01 0c 00 d0 41 03 0a 00 00 00 00 / 01 01 06 00 00 1c / 01 01 06 00 00 00 / 03 16 10 00 01 00 00 00 cc 03 00 08 a9 02 05 00 / 04 01 2a 00 02 00 00 00 06 2c 01 00 00 00 00 00 0a 82 46 07 00 00 00 00 a3 03 a5 40 53 c8 b9 4a af 7e fe 25 51 13 2e ab 02 02 / 04 03 24 00 f7 fc 74 be 7c 0b f3 49 91 47 01 f4 04 2e 68 42 11 16 48 78 44 3b 52 48 89 23 43 bc 85 79 13 26 / 04 04 9a 00 5c 00 33 00 45 00 31 00 34 00 43 00 34 00 31 00 38 00 2d 00 30 00 42 00 41 00 32 00 2d 00 34 00 42 00 35 00 34 00 2d 00 42 00 44 00 37 00 32 00 2d 00 45 00 45 00 38 00 45 00 32 00 42 00 44 00 30 00 37 00 37 00 34 00 37 00 5c 00 53 00 79 00 73 00 74 00 65 00 6d 00 5c 00 4c 00 69 00 62 00 72 00 61 00 72 00 79 00 5c 00 43 00 6f 00 72 00 65 00 53 00 65 00 72 00 76 00 69 00 63 00 65 00 73 00 5c 00 62 00 6f 00 6f 00 74 00 2e 00 65 00 66 00 69 00 00 00 / 7f ff 04 00

###### SECTION: full-dmesg
dmesg: read kernel buffer failed: Operation not permitted
